Sheet: Sheet1
A1: VORLESUNG | C1: Inhalt | D1: UEBUNG | F1: Ist auf Arbeitsblatt | G1: Aufgaben Nr | I1: TODO/Neue Aufgaben
A2: 1 | B2: 2019-10-14 | D2: 0 | E2: of:=[.B2]+1 -> 2019-10-15
B3: Kap1_Einfuehrung | E3: einfuehrung | I3: links
B4: Kap2_Algorithmen (Hälfte) | E4: praktikumSCC | I4: http://openbook.rheinwerk-verlag.de/javainsel/
E5: installationEditor | I5: https://docs.oracle.com/javase/tutorial/getStarted/intro/definition.html
E6: helloWorld
E7: kugelVolumen
E8: javaDokumentation
A10: 2 | B10: of:=[.B2]+7 -> 2019-10-21 | D10: 1 | E10: of:=[.B10]+1 -> 2019-10-22
E11: WDH Datentypen, Keywords, Schleifen
B12: Kap2 zu Ende | E12: grundl-java | F12: true | G12: of:=IF([.F12];1;0) -> 1
B13: Kap3_Grundelemente | C13: Keywords,{}, (), import | E13: grundl-literale | F13: true | G13: of:=IF([.F13];[.G12]+1;[.G12]) -> 2 | I13: mv fakultaet aufgabe HIER her
B14: Kap4_Datentypen (Hälfte) | C14: int, float, double | E14: grundl-ausdruecke | F14: true | G14: of:=IF([.F14];[.G13]+1;[.G13]) -> 3 | I14: Bloecke {} und sichtbarkeit
E15: guterStartInsPraktikum | F15: false | G15: of:=IF([.F15];[.G14]+1;[.G14]) -> 3
G16: of:=IF([.F16];[.G15]+1;[.G15]) -> 3
A17: 3 | B17: of:=[.B10]+7 -> 2019-10-28 | D17: 2 | E17: of:=[.B17]+1 -> 2019-10-29 | G17: of:=IF([.F17];[.G16]+1;[.G16]) -> 3
E18: WDH StellenwertSystem | G18: of:=IF([.F18];[.G17]+1;[.G17]) -> 3
B19: Kap4 beendet | E19: zahldarst-stellenwertsystem | F19: true | G19: of:=IF([.F19];[.G18]+1;[.G18]) -> 4
B20: Kap5_Variablen | C20: initialisieren | E20: zahldarst-binaereaddition | F20: true | G20: of:=IF([.F20];[.G19]+1;[.G19]) -> 5
B21: Kap6_Einfache_Ausdrücke | C21: %, ++, Math.abs(), cast | E21: zahldarst-ganzzahl | F21: true | G21: of:=IF([.F21];[.G20]+1;[.G20]) -> 6
B22: Kap7_Einfache_Anweisungen | C22: Systen.out.println, Scanner | E22: Schleifen-fakt | F22: false | G22: of:=IF([.F22];[.G21]+1;[.G21]) -> 6
E23: Schleifen-zetafkt | F23: false | G23: of:=IF([.F23];[.G22]+1;[.G22]) -> 6
G24: of:=IF([.F24];[.G23]+1;[.G23]) -> 6
A25: 4 | B25: of:=[.B17]+7 -> 2019-11-04 | D25: 3 | E25: of:=[.B25]+1 -> 2019-11-05 | G25: of:=IF([.F25];[.G24]+1;[.G24]) -> 6
E26: WDH BoolscheAlgebra, Prio | G26: of:=IF([.F26];[.G25]+1;[.G25]) -> 6
B27: Kap8_Weitere_Ausrücke | C27: <=, ++, &&, Priorisierung, cast | E27: grundl-boolalg | F27: true | G27: of:=IF([.F27];[.G26]+1;[.G26]) -> 7
B28: Kap9_Weitere_Anweisungen | C28: if, while, for | E28: grundl-boolalgnegation | F28: true | G28: of:=IF([.F28];[.G27]+1;[.G27]) -> 8
E29: anweis-1 | F29: true | G29: of:=IF([.F29];[.G28]+1;[.G28]) -> 9
E30: anweis-2 | F30: true | G30: of:=IF([.F30];[.G29]+1;[.G29]) -> 10
E31: WDH cast | G31: of:=IF([.F31];[.G30]+1;[.G30]) -> 10
E32: Ausdruck aus Klausur | F32: false | G32: of:=IF([.F32];[.G31]+1;[.G31]) -> 10
G33: of:=IF([.F33];[.G32]+1;[.G32]) -> 10
G34: of:=IF([.F34];[.G33]+1;[.G33]) -> 10
A35: 5 | B35: of:=[.B25]+7 -> 2019-11-11 | D35: 4 | E35: of:=[.B35]+1 -> 2019-11-12 | G35: of:=IF([.F35];[.G34]+1;[.G34]) -> 10
B36: Kap10_Rundungsfehler | C36: binaer, stellenwertsystem | E36: schleifen-2 | F36: true | G36: of:=IF([.F36];[.G35]+1;[.G35]) -> 11
C37: ueberlauf | E37: WDH rundungsfehler | G37: of:=IF([.F37];[.G36]+1;[.G36]) -> 11
E38: rundf-epsilon | F38: true | G38: of:=IF([.F38];[.G37]+1;[.G37]) -> 12
E39: anweis-fehler | F39: true | G39: of:=IF([.F39];[.G38]+1;[.G38]) -> 13
G40: of:=IF([.F40];[.G39]+1;[.G39]) -> 13
A41: 6 | B41: of:=[.B35]+7 -> 2019-11-18 | D41: 5 | E41: of:=[.B41]+1 -> 2019-11-19 | G41: of:=IF([.F41];[.G40]+1;[.G40]) -> 13
E42: WDH erzeugen, zugriff, import | G42: of:=IF([.F42];[.G41]+1;[.G41]) -> 13
B43: Kap11_Felder | C43: erzeugen, zugreifen, referenzen | E43: felder-grundl | F43: true | G43: of:=IF([.F43];[.G42]+1;[.G42]) -> 14
B44: Kap12_Methoden_und_Funktionen | C44: definitionen, argument, rueckgabe, range-based-loop | E44: Felder-berechnungen | F44: true | G44: of:=IF([.F44];[.G43]+1;[.G43]) -> 15
B45: Kap13_Methoden_und_Felder | E45: felder-felder | F45: true | G45: of:=IF([.F45];[.G44]+1;[.G44]) -> 16
E46: WDH Methoden und Felder | G46: of:=IF([.F46];[.G45]+1;[.G45]) -> 16
E47: felder-sideEff | F47: true | G47: of:=IF([.F47];[.G46]+1;[.G46]) -> 17
G48: of:=IF([.F48];[.G47]+1;[.G47]) -> 17
A49: 7 | B49: of:=[.B41]+7 -> 2019-11-25 | D49: 6 | E49: of:=[.B49]+1 -> 2019-11-26 | G49: of:=IF([.F49];[.G48]+1;[.G48]) -> 17
E50: WDH | G50: of:=IF([.F50];[.G49]+1;[.G49]) -> 17
B51: Kap14_Mehrdimensionale_Felder | E51: funktionen-grundl | G51: of:=IF([.F51];[.G50]+1;[.G50]) -> 17
B52: Kap15_Effizienz | E52: funktionen-trapez | G52: of:=IF([.F52];[.G51]+1;[.G51]) -> 17
G53: of:=IF([.F53];[.G52]+1;[.G52]) -> 17
A54: 8 | B54: of:=[.B49]+7 -> 2019-12-02 | D54: 7 | E54: of:=[.B54]+1 -> 2019-12-03 | G54: of:=IF([.F54];[.G53]+1;[.G53]) -> 17
E55: WDH | G55: of:=IF([.F55];[.G54]+1;[.G54]) -> 17
B56: Kap16_Lineare_Algebra | E56: felder-matrix | G56: of:=IF([.F56];[.G55]+1;[.G55]) -> 17
B57: Kap17_Rekursion | E57: rekursion-1 | G57: of:=IF([.F57];[.G56]+1;[.G56]) -> 17
E58: komplexitaet-eff | G58: of:=IF([.F58];[.G57]+1;[.G57]) -> 17
E59: komplexitaet-1 | G59: of:=IF([.F59];[.G58]+1;[.G58]) -> 17
G60: of:=IF([.F60];[.G59]+1;[.G59]) -> 17
A61: 9 | B61: of:=[.B54]+7 -> 2019-12-09 | D61: 8 | E61: of:=[.B61]+1 -> 2019-12-10 | G61: of:=IF([.F61];[.G60]+1;[.G60]) -> 17
E62: WDH | G62: of:=IF([.F62];[.G61]+1;[.G61]) -> 17
B63: Kap18_Sortierverfahren | E63: komplexitaet-1 | G63: of:=IF([.F63];[.G62]+1;[.G62]) -> 17
B64: Kap19_Schoener_Programmieren | E64: rekursion-3 | G64: of:=IF([.F64];[.G63]+1;[.G63]) -> 17
B65: Evaluation | E65: vorwaertseinsetzen | G65: of:=IF([.F65];[.G64]+1;[.G64]) -> 17
G66: of:=IF([.F66];[.G65]+1;[.G65]) -> 17
A67: 10 | B67: of:=[.B61]+7 -> 2019-12-16 | D67: 9 | E67: of:=[.B67]+1 -> 2019-12-17 | G67: of:=IF([.F67];[.G66]+1;[.G66]) -> 17
E68: WDH | G68: of:=IF([.F68];[.G67]+1;[.G67]) -> 17
B69: Kap20_Klassen | E69: funktionen-ss2019 | G69: of:=IF([.F69];[.G68]+1;[.G68]) -> 17
B70: Kap21_Klassen_mit_Instanzmethoden | E70: strukt-artikel | G70: of:=IF([.F70];[.G69]+1;[.G69]) -> 17
G71: of:=IF([.F71];[.G70]+1;[.G70]) -> 17
A72: 11 | B72: of:=[.B67]+21 -> 2020-01-06 | D72: 10 | E72: of:=[.B72]+1 -> 2020-01-07 | G72: of:=IF([.F72];[.G71]+1;[.G71]) -> 17
E73: WDH | G73: of:=IF([.F73];[.G72]+1;[.G72]) -> 17
B74: Kap21_Klassen_mit_Instanzmethoden | E74: klassen-komplex | G74: of:=IF([.F74];[.G73]+1;[.G73]) -> 17
B75: Kap22_Vererbung (bis 22.6) | E75: klassen-hierarchie | G75: of:=IF([.F75];[.G74]+1;[.G74]) -> 17
G76: of:=IF([.F76];[.G75]+1;[.G75]) -> 17
A77: 12 | B77: of:=[.B72]+7 -> 2020-01-13 | D77: of:=[.A77]-1 -> 11 | E77: of:=[.B77]+1 -> 2020-01-14 | G77: of:=IF([.F77];[.G76]+1;[.G76]) -> 17
B78: Kap22_Vererbung (beendet) | E78: klassen-wal | G78: of:=IF([.F78];[.G77]+1;[.G77]) -> 17
B79: Kap23_Ergaenzungen_Klassen | E79: klassen-bild | G79: of:=IF([.F79];[.G78]+1;[.G78]) -> 17
B80: Kap24_Klassenbeziehungen | G80: of:=IF([.F80];[.G79]+1;[.G79]) -> 17
G81: of:=IF([.F81];[.G80]+1;[.G80]) -> 17
A82: 13 | B82: of:=[.B77]+7 -> 2020-01-20 | E82: of:=[.B82]+1 -> 2020-01-21 | G82: of:=IF([.F82];[.G81]+1;[.G81]) -> 17
B83: Bis Kapitel 29 | E83: Probleklausur | G83: of:=IF([.F83];[.G82]+1;[.G82]) -> 17
G84: of:=IF([.F84];[.G83]+1;[.G83]) -> 17
A85: 14 | B85: of:=[.B82]+7 -> 2020-01-27 | E85: of:=[.B85]+1 -> 2020-01-28 | G85: of:=IF([.F85];[.G84]+1;[.G84]) -> 17
E86: Probleklausur - Besprechung | G86: of:=IF([.F86];[.G85]+1;[.G85]) -> 17
G87: of:=IF([.F87];[.G86]+1;[.G86]) -> 17
G88: of:=IF([.F88];[.G87]+1;[.G87]) -> 17